{
    "entity_type": "sun",
    "collision_shape": {
        "type": "sphere",
        "radius": {
            "value": 10.0,
            "unit": "m"
        }
    },
    "bounding_box": {
        "min": {
            "x": {
                "value": -10.0,
                "unit": "m"
            },
            "y": {
                "value": -10.0,
                "unit": "m"
            },
            "z": {
                "value": -10.0,
                "unit": "m"
            }
        },
        "max": {
            "x": {
                "value": 10.0,
                "unit": "m"
            },
            "y": {
                "value": 10.0,
                "unit": "m"
            },
            "z": {
                "value": 10.0,
                "unit": "m"
            }
        }
    },
    "is_gravity_source": true,
    "rotation_period": {
        "value": 600.0,
        "unit": "h"
    },
    "light_intensity": 3.5e+28,
    "light_color": {
        "r": 1.0,
        "g": 0.95,
        "b": 0.8
    },
    "light_range": {
        "value": 6000000000000.0,
        "unit": "m"
    }
}
